{
  "$schema": "../../schema.json",
  "schema_version": 1,
  "id": "material/material_16_synth_renderer_compare_selected",
  "title": "Material 16 Synth Renderer Compare Selected",
  "summary": "선택한 synthetic 조건에서 Donut Deferred, Deferred+Prepass, binned VisBuf 전체 파이프라인을 비교한다.",
  "tags": [
    "material",
    "runnable_now"
  ],
  "reproduction": {
    "fidelity": "exact",
    "legacy_source": "datas/experiments_3/material_experiments/16_synth_renderer_compare_selected.json"
  },
  "executable": "@executable/release",
  "repeat": 1,
  "timeout_seconds": 2400,
  "keep_individual_csv": false,
  "base": {
    "renderer_variant": 9,
    "variable": 0,
    "to_use_scene": false,
    "to_load_texture": false,
    "use_vfc": false,
    "scene_variant": 1,
    "scene_importer": "auto",
    "scene_path": "unused",
    "warmup_frames": 120,
    "measure_frames": 600,
    "vsync": false,
    "camera_mode": 0,
    "camera_filepath": "@camera/standard_camera",
    "camera_keyframe_interval": 10,
    "to_set_start_frame": false,
    "key_frame": 0,
    "profile_window_frames": 60,
    "capture_frames": false,
    "capture_stride": 1,
    "capture_fps": 60,
    "window_width": 1920,
    "window_height": 1080,
    "seed": 0,
    "material_assign_strategy": 0,
    "material_assign_max_open": 64,
    "material_assign_locality": 1.0,
    "material_assign_diversity": 1.0,
    "geometry_div": 64,
    "camera_pos_x": 0.0,
    "camera_pos_y": 0.0,
    "camera_pos_z": -3,
    "camera_lookat_x": 0.0,
    "camera_lookat_y": 0.0,
    "camera_lookat_z": 0.0,
    "camera_near_z": 0.1,
    "camera_far_z": 1000,
    "camera_fov": 0.785,
    "object_count": 1,
    "material_count": 64,
    "geometry_count": 1,
    "overdraw_count": 0,
    "to_remain_only_in_camera": false,
    "z_min": -1.0,
    "z_max": 1.0,
    "xy_minmax": 1.0,
    "radius": 0.5,
    "gbuffer_cnt": 1,
    "texture_count": 1,
    "texture_size": 256,
    "texture_sampling_count": 1,
    "alu_calc_count": 100
  },
  "samples": [
    {
      "variable": 0,
      "renderer_variant": 7,
      "material_count": 1,
      "material_assign_max_open": 1,
      "material_assign_locality": 1.0,
      "material_assign_diversity": 1.0
    },
    {
      "variable": 1,
      "renderer_variant": 8,
      "material_count": 1,
      "material_assign_max_open": 1,
      "material_assign_locality": 1.0,
      "material_assign_diversity": 1.0
    },
    {
      "variable": 2,
      "renderer_variant": 9,
      "material_count": 1,
      "material_assign_max_open": 1,
      "material_assign_locality": 1.0,
      "material_assign_diversity": 1.0
    },
    {
      "variable": 3,
      "renderer_variant": 7,
      "material_assign_max_open": 64,
      "material_assign_locality": 1.0,
      "material_assign_diversity": 1.0
    },
    {
      "variable": 4,
      "renderer_variant": 8,
      "material_assign_max_open": 64,
      "material_assign_locality": 1.0,
      "material_assign_diversity": 1.0
    },
    {
      "variable": 5,
      "renderer_variant": 9,
      "material_assign_max_open": 64,
      "material_assign_locality": 1.0,
      "material_assign_diversity": 1.0
    },
    {
      "variable": 6,
      "renderer_variant": 7,
      "material_assign_max_open": 64,
      "material_assign_locality": 0.0,
      "material_assign_diversity": 1.0
    },
    {
      "variable": 7,
      "renderer_variant": 8,
      "material_assign_max_open": 64,
      "material_assign_locality": 0.0,
      "material_assign_diversity": 1.0
    },
    {
      "variable": 8,
      "renderer_variant": 9,
      "material_assign_max_open": 64,
      "material_assign_locality": 0.0,
      "material_assign_diversity": 1.0
    },
    {
      "variable": 9,
      "renderer_variant": 7,
      "material_assign_max_open": 64,
      "material_assign_locality": 0.0,
      "material_assign_diversity": 0.25
    },
    {
      "variable": 10,
      "renderer_variant": 8,
      "material_assign_max_open": 64,
      "material_assign_locality": 0.0,
      "material_assign_diversity": 0.25
    },
    {
      "variable": 11,
      "renderer_variant": 9,
      "material_assign_max_open": 64,
      "material_assign_locality": 0.0,
      "material_assign_diversity": 0.25
    }
  ],
  "analysis": {
    "plots": [
      {
        "id": "total_time",
        "type": "total",
        "x": "auto",
        "metric": "total_time_median_ms",
        "title": "Median GPU time"
      },
      {
        "id": "pass_breakdown",
        "type": "pass_breakdown",
        "title": "GPU pass breakdown"
      }
    ]
  }
}
