{
  "$schema": "../../schema.json",
  "schema_version": 1,
  "id": "captures/material_debug_camera_capture",
  "title": "Material Debug Camera Capture",
  "summary": "Material identity and PBR-feature bin debug views along the complete Sponza, Sponza + Ivy, and Bistro camera paths.",
  "tags": [
    "captures",
    "capture_only"
  ],
  "reproduction": {
    "fidelity": "exact",
    "legacy_source": "datas/experiments_3/material_experiments/debug_camera_capture.json"
  },
  "executable": "@executable/release",
  "repeat": 1,
  "timeout_seconds": 7200,
  "keep_individual_csv": true,
  "base": {
    "renderer_variant": 13,
    "visibility_debug_mode": 10,
    "variable": 0,
    "to_use_scene": true,
    "to_load_texture": true,
    "use_vfc": true,
    "scene_variant": 0,
    "scene_importer": "assimp",
    "scene_path": "@scene/sponza",
    "warmup_frames": 60,
    "measure_frames": 2500,
    "vsync": false,
    "camera_mode": 2,
    "camera_filepath": "@camera/standard_camera",
    "camera_keyframe_interval": 10,
    "to_set_start_frame": false,
    "key_frame": 0,
    "profile_window_frames": 60,
    "capture_frames": true,
    "capture_stride": 60,
    "capture_fps": 12,
    "window_width": 1280,
    "window_height": 720,
    "seed": 0,
    "material_assign_strategy": 1,
    "material_assign_max_open": 255,
    "material_assign_locality": 1.0,
    "material_assign_diversity": 1.0,
    "geometry_div": 1,
    "camera_pos_x": 0.0,
    "camera_pos_y": 0.0,
    "camera_pos_z": -10.0,
    "camera_lookat_x": 0.0,
    "camera_lookat_y": 0.0,
    "camera_lookat_z": 0.0,
    "camera_near_z": 0.1,
    "camera_far_z": 1000.0,
    "camera_fov": 0.785,
    "object_count": 1,
    "material_count": 1,
    "geometry_count": 1,
    "overdraw_count": 0,
    "to_remain_only_in_camera": false,
    "z_min": -1.0,
    "z_max": 1.0,
    "xy_minmax": 1.0,
    "radius": 0.5,
    "gbuffer_cnt": 1,
    "texture_count": 1,
    "texture_size": 256,
    "texture_sampling_count": 1,
    "alu_calc_count": 100
  },
  "samples": [
    {
      "_sequence_id": "sponza-material-id",
      "variable": 0,
      "visibility_debug_mode": 10
    },
    {
      "_sequence_id": "sponza-material-bin",
      "variable": 1,
      "visibility_debug_mode": 11
    },
    {
      "_sequence_id": "sponza-ivy-material-id",
      "variable": 2,
      "visibility_debug_mode": 10,
      "scene_path": "@scene/sponza_ivy"
    },
    {
      "_sequence_id": "sponza-ivy-material-bin",
      "variable": 3,
      "visibility_debug_mode": 11,
      "scene_path": "@scene/sponza_ivy"
    },
    {
      "_sequence_id": "bistro-material-id",
      "variable": 4,
      "visibility_debug_mode": 10,
      "scene_path": "@scene/bistro",
      "camera_filepath": "@camera/standard_camera_bistro",
      "measure_frames": 5500,
      "capture_stride": 120
    },
    {
      "_sequence_id": "bistro-material-bin",
      "variable": 5,
      "visibility_debug_mode": 11,
      "scene_path": "@scene/bistro",
      "camera_filepath": "@camera/standard_camera_bistro",
      "measure_frames": 5500,
      "capture_stride": 120
    }
  ],
  "analysis": {
    "plots": [
      {
        "id": "total_time",
        "type": "total",
        "x": "auto",
        "metric": "total_time_median_ms",
        "title": "Median GPU time"
      },
      {
        "id": "pass_breakdown",
        "type": "pass_breakdown",
        "title": "GPU pass breakdown"
      }
    ]
  }
}
