{
  "$schema": "../../schema.json",
  "schema_version": 1,
  "id": "material/material_32_nsight_representative_cases",
  "title": "Material 32 Nsight Representative Cases",
  "summary": "Nsight에서 캡처할 대표 조건을 같은 실행 인자로 재현하기 위한 짧은 case 모음이다.",
  "tags": [
    "material",
    "runnable_now"
  ],
  "reproduction": {
    "fidelity": "exact",
    "legacy_source": "datas/experiments_3/material_experiments/32_nsight_representative_cases.json"
  },
  "executable": "@executable/release",
  "repeat": 1,
  "timeout_seconds": 3600,
  "keep_individual_csv": true,
  "base": {
    "renderer_variant": 9,
    "variable": 0,
    "to_use_scene": true,
    "to_load_texture": true,
    "use_vfc": true,
    "scene_variant": 0,
    "scene_importer": "assimp",
    "scene_path": "@scene/sponza",
    "warmup_frames": 120,
    "measure_frames": 300,
    "vsync": false,
    "camera_mode": 2,
    "camera_filepath": "@camera/standard_camera",
    "camera_keyframe_interval": 10,
    "to_set_start_frame": false,
    "key_frame": 0,
    "profile_window_frames": 60,
    "capture_frames": false,
    "capture_stride": 1,
    "capture_fps": 60,
    "window_width": 1920,
    "window_height": 1080,
    "seed": 0,
    "material_assign_strategy": 0,
    "material_assign_max_open": 64,
    "material_assign_locality": 1.0,
    "material_assign_diversity": 1.0,
    "geometry_div": 1,
    "camera_pos_x": 0.0,
    "camera_pos_y": 0.0,
    "camera_pos_z": -10.0,
    "camera_lookat_x": 0.0,
    "camera_lookat_y": 0.0,
    "camera_lookat_z": 0.0,
    "camera_near_z": 0.1,
    "camera_far_z": 1000.0,
    "camera_fov": 0.785,
    "object_count": 1,
    "material_count": 1,
    "geometry_count": 1,
    "overdraw_count": 0,
    "to_remain_only_in_camera": false,
    "z_min": -1.0,
    "z_max": 1.0,
    "xy_minmax": 1.0,
    "radius": 0.5,
    "gbuffer_cnt": 1,
    "texture_count": 1,
    "texture_size": 256,
    "texture_sampling_count": 1,
    "alu_calc_count": 100
  },
  "samples": [
    {
      "variable": 0,
      "to_use_scene": false,
      "scene_variant": 1,
      "renderer_variant": 9,
      "camera_mode": 0,
      "camera_pos_z": -3.0,
      "use_vfc": false,
      "to_load_texture": false,
      "geometry_div": 64,
      "material_count": 1,
      "material_assign_max_open": 1,
      "material_assign_locality": 1.0,
      "material_assign_diversity": 1.0,
      "measure_frames": 300
    },
    {
      "variable": 1,
      "to_use_scene": false,
      "scene_variant": 1,
      "renderer_variant": 9,
      "camera_mode": 0,
      "camera_pos_z": -3.0,
      "use_vfc": false,
      "to_load_texture": false,
      "geometry_div": 64,
      "material_count": 64,
      "material_assign_max_open": 64,
      "material_assign_locality": 1.0,
      "material_assign_diversity": 1.0,
      "measure_frames": 300
    },
    {
      "variable": 2,
      "to_use_scene": false,
      "scene_variant": 1,
      "renderer_variant": 9,
      "camera_mode": 0,
      "camera_pos_z": -3.0,
      "use_vfc": false,
      "to_load_texture": false,
      "geometry_div": 64,
      "material_count": 64,
      "material_assign_max_open": 64,
      "material_assign_locality": 0.0,
      "material_assign_diversity": 1.0,
      "measure_frames": 300
    },
    {
      "variable": 3,
      "to_use_scene": false,
      "scene_variant": 1,
      "renderer_variant": 9,
      "camera_mode": 0,
      "camera_pos_z": -3.0,
      "use_vfc": false,
      "to_load_texture": false,
      "geometry_div": 64,
      "material_count": 255,
      "material_assign_max_open": 255,
      "material_assign_locality": 0.0,
      "material_assign_diversity": 1.0,
      "measure_frames": 300
    },
    {
      "variable": 4,
      "to_use_scene": true,
      "scene_variant": 0,
      "renderer_variant": 8,
      "scene_importer": "assimp",
      "scene_path": "@scene/sponza",
      "camera_mode": 2,
      "camera_filepath": "@camera/standard_camera",
      "use_vfc": true,
      "to_load_texture": true,
      "material_assign_strategy": 1,
      "material_assign_max_open": 255,
      "material_assign_diversity": 1.0,
      "measure_frames": 300
    },
    {
      "variable": 5,
      "to_use_scene": true,
      "scene_variant": 0,
      "renderer_variant": 9,
      "scene_importer": "assimp",
      "scene_path": "@scene/sponza",
      "camera_mode": 2,
      "camera_filepath": "@camera/standard_camera",
      "use_vfc": true,
      "to_load_texture": true,
      "material_assign_strategy": 1,
      "material_assign_max_open": 255,
      "material_assign_diversity": 1.0,
      "measure_frames": 300
    },
    {
      "variable": 6,
      "to_use_scene": true,
      "scene_variant": 0,
      "renderer_variant": 9,
      "scene_importer": "assimp",
      "scene_path": "@scene/sponza",
      "camera_mode": 2,
      "camera_filepath": "@camera/standard_camera",
      "use_vfc": true,
      "to_load_texture": true,
      "material_assign_strategy": 0,
      "material_assign_max_open": 64,
      "material_assign_diversity": 1.0,
      "measure_frames": 300
    },
    {
      "variable": 7,
      "to_use_scene": true,
      "scene_variant": 0,
      "renderer_variant": 8,
      "scene_importer": "assimp",
      "scene_path": "@scene/bistro",
      "camera_mode": 2,
      "camera_filepath": "@camera/standard_camera_bistro",
      "use_vfc": true,
      "to_load_texture": true,
      "material_assign_strategy": 1,
      "material_assign_max_open": 255,
      "material_assign_diversity": 1.0,
      "measure_frames": 300
    },
    {
      "variable": 8,
      "to_use_scene": true,
      "scene_variant": 0,
      "renderer_variant": 9,
      "scene_importer": "assimp",
      "scene_path": "@scene/bistro",
      "camera_mode": 2,
      "camera_filepath": "@camera/standard_camera_bistro",
      "use_vfc": true,
      "to_load_texture": true,
      "material_assign_strategy": 1,
      "material_assign_max_open": 255,
      "material_assign_diversity": 1.0,
      "measure_frames": 300
    },
    {
      "variable": 9,
      "to_use_scene": true,
      "scene_variant": 0,
      "renderer_variant": 9,
      "scene_importer": "assimp",
      "scene_path": "@scene/bistro",
      "camera_mode": 2,
      "camera_filepath": "@camera/standard_camera_bistro",
      "use_vfc": true,
      "to_load_texture": true,
      "material_assign_strategy": 0,
      "material_assign_max_open": 64,
      "material_assign_diversity": 1.0,
      "measure_frames": 300
    }
  ],
  "analysis": {
    "plots": [
      {
        "id": "total_time",
        "type": "total",
        "x": "auto",
        "metric": "total_time_median_ms",
        "title": "Median GPU time"
      },
      {
        "id": "pass_breakdown",
        "type": "pass_breakdown",
        "title": "GPU pass breakdown"
      }
    ]
  }
}
