{
  "$schema": "../../schema.json",
  "schema_version": 1,
  "id": "validation/barycentric_reference_smoke",
  "title": "Barycentric Reference Smoke",
  "summary": "Shader/runtime smoke for identical raster-reference and VisBuf barycentric captures. This is not a performance experiment.",
  "tags": [
    "validation",
    "smoke_only"
  ],
  "reproduction": {
    "fidelity": "exact",
    "legacy_source": "datas/experiments_3/barycentric_validation/barycentric_reference_smoke.json"
  },
  "executable": "@executable/release",
  "repeat": 1,
  "timeout_seconds": 1800,
  "keep_individual_csv": true,
  "base": {
    "renderer_variant": 14,
    "visibility_debug_mode": 3,
    "variable": 0,
    "to_use_scene": true,
    "to_load_texture": true,
    "use_vfc": true,
    "scene_variant": 0,
    "scene_importer": "assimp",
    "scene_path": "@scene/sponza",
    "warmup_frames": 2,
    "measure_frames": 6,
    "vsync": false,
    "camera_mode": 2,
    "camera_filepath": "@camera/standard_camera",
    "camera_keyframe_interval": 10,
    "to_set_start_frame": false,
    "key_frame": 0,
    "profile_window_frames": 2,
    "capture_frames": true,
    "capture_stride": 1,
    "capture_fps": 6,
    "window_width": 1280,
    "window_height": 720,
    "seed": 0,
    "material_assign_strategy": 1,
    "material_assign_max_open": 255,
    "material_assign_locality": 1.0,
    "material_assign_diversity": 1.0,
    "camera_pos_x": 0.0,
    "camera_pos_y": 0.0,
    "camera_pos_z": -10.0,
    "camera_lookat_x": 0.0,
    "camera_lookat_y": 0.0,
    "camera_lookat_z": 0.0,
    "camera_near_z": 0.1,
    "camera_far_z": 1000.0,
    "camera_fov": 0.785,
    "object_count": 1,
    "material_count": 1,
    "geometry_count": 1,
    "overdraw_count": 0,
    "to_remain_only_in_camera": false,
    "z_min": -1.0,
    "z_max": 1.0,
    "xy_minmax": 1.0,
    "radius": 0.5,
    "geometry_div": 1,
    "gbuffer_cnt": 1,
    "texture_count": 1,
    "texture_size": 256,
    "texture_sampling_count": 1,
    "alu_calc_count": 100
  },
  "samples": [
    {
      "_path": "raster_reference",
      "renderer_variant": 14,
      "variable": 0
    },
    {
      "_path": "visbuf_reconstruction",
      "renderer_variant": 13,
      "variable": 1
    }
  ],
  "analysis": {
    "plots": [
      {
        "id": "total_time",
        "type": "total",
        "x": "auto",
        "metric": "total_time_median_ms",
        "title": "Median GPU time"
      },
      {
        "id": "pass_breakdown",
        "type": "pass_breakdown",
        "title": "GPU pass breakdown"
      }
    ]
  }
}
