{
  "$schema": "../../schema.json",
  "schema_version": 1,
  "id": "real_scenes/followup_17_real_material_camera_bistro_texture_on",
  "title": "Followup 17 Real Material Camera Bistro Texture On",
  "summary": "Full-camera bistro material-class scaling with textures on; balanced exact bins; Donut DeferredPrepass versus Donut VisGBuffer.",
  "tags": [
    "real_scenes",
    "runnable_now"
  ],
  "reproduction": {
    "fidelity": "exact",
    "legacy_source": "datas/experiments_3/followup_experiments/17_real_material_camera_bistro_texture_on.json"
  },
  "executable": "@executable/release",
  "repeat": 1,
  "timeout_seconds": 7200,
  "keep_individual_csv": true,
  "base": {
    "renderer_variant": 8,
    "visibility_debug_mode": 0,
    "donut_linear_gbuffer": false,
    "variable": 1,
    "to_use_scene": true,
    "to_load_texture": true,
    "use_vfc": true,
    "scene_variant": 0,
    "scene_importer": "assimp",
    "scene_path": "@scene/bistro",
    "warmup_frames": 60,
    "measure_frames": 5474,
    "vsync": false,
    "camera_mode": 2,
    "camera_filepath": "@camera/standard_camera_bistro",
    "camera_keyframe_interval": 10,
    "to_set_start_frame": false,
    "key_frame": 0,
    "profile_window_frames": 50,
    "capture_frames": false,
    "capture_stride": 1,
    "capture_fps": 60,
    "window_width": 1920,
    "window_height": 1080,
    "seed": 0,
    "material_assign_strategy": 2,
    "material_assign_max_open": 1,
    "material_assign_locality": 1.0,
    "material_assign_diversity": 1.0,
    "geometry_div": 1,
    "camera_pos_x": 0.0,
    "camera_pos_y": 0.0,
    "camera_pos_z": -10.0,
    "camera_lookat_x": 0.0,
    "camera_lookat_y": 0.0,
    "camera_lookat_z": 0.0,
    "camera_near_z": 0.1,
    "camera_far_z": 1000.0,
    "camera_fov": 0.785,
    "object_count": 1,
    "material_count": 1,
    "geometry_count": 1,
    "overdraw_count": 0,
    "to_remain_only_in_camera": false,
    "z_min": -1.0,
    "z_max": 1.0,
    "xy_minmax": 1.0,
    "radius": 0.5,
    "gbuffer_cnt": 1,
    "texture_count": 1,
    "texture_size": 256,
    "texture_sampling_count": 1,
    "alu_calc_count": 100
  },
  "samples": [
    {
      "renderer_variant": 8,
      "variable": 1,
      "material_assign_max_open": 1
    },
    {
      "renderer_variant": 9,
      "variable": 1,
      "material_assign_max_open": 1
    },
    {
      "renderer_variant": 8,
      "variable": 2,
      "material_assign_max_open": 2
    },
    {
      "renderer_variant": 9,
      "variable": 2,
      "material_assign_max_open": 2
    },
    {
      "renderer_variant": 8,
      "variable": 3,
      "material_assign_max_open": 3
    },
    {
      "renderer_variant": 9,
      "variable": 3,
      "material_assign_max_open": 3
    },
    {
      "renderer_variant": 8,
      "variable": 4,
      "material_assign_max_open": 4
    },
    {
      "renderer_variant": 9,
      "variable": 4,
      "material_assign_max_open": 4
    },
    {
      "renderer_variant": 8,
      "variable": 5,
      "material_assign_max_open": 5
    },
    {
      "renderer_variant": 9,
      "variable": 5,
      "material_assign_max_open": 5
    },
    {
      "renderer_variant": 8,
      "variable": 6,
      "material_assign_max_open": 6
    },
    {
      "renderer_variant": 9,
      "variable": 6,
      "material_assign_max_open": 6
    },
    {
      "renderer_variant": 8,
      "variable": 8,
      "material_assign_max_open": 8
    },
    {
      "renderer_variant": 9,
      "variable": 8,
      "material_assign_max_open": 8
    },
    {
      "renderer_variant": 8,
      "variable": 10,
      "material_assign_max_open": 10
    },
    {
      "renderer_variant": 9,
      "variable": 10,
      "material_assign_max_open": 10
    },
    {
      "renderer_variant": 8,
      "variable": 12,
      "material_assign_max_open": 12
    },
    {
      "renderer_variant": 9,
      "variable": 12,
      "material_assign_max_open": 12
    },
    {
      "renderer_variant": 8,
      "variable": 16,
      "material_assign_max_open": 16
    },
    {
      "renderer_variant": 9,
      "variable": 16,
      "material_assign_max_open": 16
    },
    {
      "renderer_variant": 8,
      "variable": 20,
      "material_assign_max_open": 20
    },
    {
      "renderer_variant": 9,
      "variable": 20,
      "material_assign_max_open": 20
    },
    {
      "renderer_variant": 8,
      "variable": 24,
      "material_assign_max_open": 24
    },
    {
      "renderer_variant": 9,
      "variable": 24,
      "material_assign_max_open": 24
    },
    {
      "renderer_variant": 8,
      "variable": 32,
      "material_assign_max_open": 32
    },
    {
      "renderer_variant": 9,
      "variable": 32,
      "material_assign_max_open": 32
    },
    {
      "renderer_variant": 8,
      "variable": 40,
      "material_assign_max_open": 40
    },
    {
      "renderer_variant": 9,
      "variable": 40,
      "material_assign_max_open": 40
    },
    {
      "renderer_variant": 8,
      "variable": 48,
      "material_assign_max_open": 48
    },
    {
      "renderer_variant": 9,
      "variable": 48,
      "material_assign_max_open": 48
    },
    {
      "renderer_variant": 8,
      "variable": 64,
      "material_assign_max_open": 64
    },
    {
      "renderer_variant": 9,
      "variable": 64,
      "material_assign_max_open": 64
    },
    {
      "renderer_variant": 8,
      "variable": 80,
      "material_assign_max_open": 80
    },
    {
      "renderer_variant": 9,
      "variable": 80,
      "material_assign_max_open": 80
    },
    {
      "renderer_variant": 8,
      "variable": 96,
      "material_assign_max_open": 96
    },
    {
      "renderer_variant": 9,
      "variable": 96,
      "material_assign_max_open": 96
    },
    {
      "renderer_variant": 8,
      "variable": 112,
      "material_assign_max_open": 112
    },
    {
      "renderer_variant": 9,
      "variable": 112,
      "material_assign_max_open": 112
    },
    {
      "renderer_variant": 8,
      "variable": 128,
      "material_assign_max_open": 128
    },
    {
      "renderer_variant": 9,
      "variable": 128,
      "material_assign_max_open": 128
    },
    {
      "renderer_variant": 8,
      "variable": 132,
      "material_assign_max_open": 132
    },
    {
      "renderer_variant": 9,
      "variable": 132,
      "material_assign_max_open": 132
    }
  ],
  "analysis": {
    "plots": [
      {
        "id": "total_time",
        "type": "total",
        "x": "auto",
        "metric": "total_time_median_ms",
        "title": "Median GPU time"
      },
      {
        "id": "pass_breakdown",
        "type": "pass_breakdown",
        "title": "GPU pass breakdown"
      }
    ]
  }
}
